id,date,severity,source_file,problem,impact,recommended_fix,status,blocks_work
1,2026-06-09,High,agents/permissions/info/permissions.csv,"תפקיד admin השתמש בהרשאת all ללא רשימת API ורכיבים מפורשת","לא ניתן היה לוודא הרשאה מינימלית והתאמה למקורות האמת","ההרשאה הגורפת הוחלפה ברשימות API ורכיבים מפורשות שנבדקו מול מקורות האמת",fixed,no
2,2026-06-09,High,src/server/routes/auth-routes.ts,"הנתיב POST /api/auth/logout לא הפעיל requireAdmin אף ש-api_list.csv מגדיר required_role=admin","החוזה והמימוש לא היו תואמים","נוסף requireAdmin לנתיב logout",fixed,no
3,2026-06-09,Medium,agents/permissions/info/permissions.csv,"רשימת allowed_components של guest כללה navbar בעוד components_list.csv מגדיר אותו ל-admin בלבד","מקורות האמת לא הסכימו לגבי נראות הרכיב","navbar הוסר מרשימת רכיבי guest",fixed,no
4,2026-06-09,Medium,agents/components/info/components_list.csv,"login-page הצהיר על auth_me אך כניסה ישירה ל-/login לא בדקה session","מנהל עם cookie תקף יכול היה לראות את עמוד ההתחברות לאחר רענון ישיר","ה-router בודק session גם ב-/login ומנתב מנהל מחובר לעמוד המתאים",fixed,no
5,2026-06-09,High,agents/qa/info/test_results.csv,"AI QA לא אישר QA מלא: 5 תרחישים מסומנים BLOCKED ו-3 תרחישים מסומנים NOT_RUN","Definition Of Done לא התקיים ללא הוכחת E2E למסד הנתונים וללא Visual QA בדפדפן עבור ניתוב רספונסיבי ו-Design Profiles","תרחישי MySQL ו-HTTP E2E הורצו במסדי QA זמניים ותועדו כ-PASS; Visual QA הורץ ב-Chrome headless ותועד כ-PASS ב-QAR-017 וב-QAR-029",fixed,no
6,2026-06-09,Medium,agents/api/info/api_list.csv,"auth_logout הוגדר required_role=admin ומוגן ב-requireAdmin אך עמודת middleware תיעדה sameOrigin בלבד","תיעוד שרשרת ה-middleware לא היה מלא","עמודת middleware עודכנה ל-sameOrigin|requireAdmin",fixed,no
